<?xml version="1.0" encoding="UTF-8"?>
<unexpectedTraffic xmlns="" xmlns:xsi="http://www.w3.org/2001/XMLSchema-instance" xsi:noNamespaceSchemaLocation="unexpectedtrafficGETService.xsd">
	<title>On the way from Roosendaal to Rotterdam roads are blocked because of a truck accident. The estimated 
		time of clearing is currently unpredictable.
	</title>
	<source>1849</source>
    <delay>30</delay>
	<timestamp>2012-02-01T15:52:44.694</timestamp>
		<coordinate>
			<latitude>51.94683</latitude>
			<longitude>4.03339</longitude>
		</coordinate>
</unexpectedTraffic>